{
  "$schema": "deepfield-content/1",
  "table": "enemies",
  "generated": "2026-09-17T07:21:16Z",
  "sourceSha": "b44eea1",
  "rows": [
    {
      "id": "drifter",
      "hp": 20,
      "speedMetersPerSec": 2.5,
      "bounty": 6,
      "leakDamage": 1,
      "layer": "Ground",
      "contactDamage": 8,
      "scatterWidth": 0,
      "blocksSight": false,
      "frontArmorArcDegrees": 0,
      "frontArmorFactor": 1,
      "rearWeakFactor": 1,
      "shield": 0,
      "flatArmor": 0,
      "mass": 1,
      "burrower": false,
      "splitCount": 0,
      "scrapYield": {
        "Alloy": 2
      },
      "stealth": false,
      "stealthSpeedBonus": 0,
      "healPerSecond": 0,
      "healRadius": 0,
      "structureDps": 0,
      "structureReach": 0,
      "enrageBelowHpFraction": 0,
      "enrageSpeedFactor": 1
    },
    {
      "id": "mote",
      "hp": 7,
      "speedMetersPerSec": 3.4,
      "bounty": 2,
      "leakDamage": 1,
      "layer": "Ground",
      "contactDamage": 4,
      "scatterWidth": 2.8,
      "blocksSight": false,
      "frontArmorArcDegrees": 0,
      "frontArmorFactor": 1,
      "rearWeakFactor": 1,
      "shield": 0,
      "flatArmor": 0,
      "mass": 1,
      "burrower": false,
      "splitCount": 0,
      "scrapYield": {
        "Alloy": 1
      },
      "stealth": false,
      "stealthSpeedBonus": 0,
      "healPerSecond": 0,
      "healRadius": 0,
      "structureDps": 0,
      "structureReach": 0,
      "enrageBelowHpFraction": 0,
      "enrageSpeedFactor": 1
    },
    {
      "id": "monolith",
      "hp": 150,
      "speedMetersPerSec": 1.1,
      "bounty": 34,
      "leakDamage": 1,
      "layer": "Ground",
      "contactDamage": 16,
      "scatterWidth": 0,
      "blocksSight": true,
      "frontArmorArcDegrees": 0,
      "frontArmorFactor": 1,
      "rearWeakFactor": 1,
      "shield": 0,
      "flatArmor": 0,
      "mass": 8,
      "burrower": false,
      "splitCount": 0,
      "scrapYield": {
        "Alloy": 4,
        "Plating": 2,
        "Gravium": 1
      },
      "stealth": false,
      "stealthSpeedBonus": 0,
      "healPerSecond": 0,
      "healRadius": 0,
      "structureDps": 0,
      "structureReach": 0,
      "enrageBelowHpFraction": 0,
      "enrageSpeedFactor": 1
    },
    {
      "id": "warden",
      "hp": 60,
      "speedMetersPerSec": 1.5,
      "bounty": 16,
      "leakDamage": 1,
      "layer": "Ground",
      "contactDamage": 10,
      "scatterWidth": 0,
      "blocksSight": false,
      "frontArmorArcDegrees": 0,
      "frontArmorFactor": 1,
      "rearWeakFactor": 1,
      "shield": 25,
      "flatArmor": 0,
      "mass": 1,
      "burrower": false,
      "splitCount": 0,
      "scrapYield": {
        "Flux": 3
      },
      "stealth": false,
      "stealthSpeedBonus": 0,
      "healPerSecond": 0,
      "healRadius": 0,
      "structureDps": 0,
      "structureReach": 0,
      "enrageBelowHpFraction": 0,
      "enrageSpeedFactor": 1
    },
    {
      "id": "mole",
      "hp": 34,
      "speedMetersPerSec": 2.2,
      "bounty": 12,
      "leakDamage": 1,
      "layer": "Ground",
      "contactDamage": 6,
      "scatterWidth": 0,
      "blocksSight": false,
      "frontArmorArcDegrees": 0,
      "frontArmorFactor": 1,
      "rearWeakFactor": 1,
      "shield": 0,
      "flatArmor": 0,
      "mass": 1,
      "burrower": true,
      "splitCount": 0,
      "scrapYield": {
        "Alloy": 2,
        "Flux": 1
      },
      "stealth": false,
      "stealthSpeedBonus": 0,
      "healPerSecond": 0,
      "healRadius": 0,
      "structureDps": 0,
      "structureReach": 0,
      "enrageBelowHpFraction": 0,
      "enrageSpeedFactor": 1
    },
    {
      "id": "cluster",
      "hp": 40,
      "speedMetersPerSec": 1.9,
      "bounty": 10,
      "leakDamage": 1,
      "layer": "Ground",
      "contactDamage": 8,
      "scatterWidth": 0,
      "blocksSight": false,
      "frontArmorArcDegrees": 0,
      "frontArmorFactor": 1,
      "rearWeakFactor": 1,
      "shield": 0,
      "flatArmor": 0,
      "mass": 1,
      "burrower": false,
      "splitInto": "mote",
      "splitCount": 5,
      "scrapYield": {
        "Alloy": 3
      },
      "stealth": false,
      "stealthSpeedBonus": 0,
      "healPerSecond": 0,
      "healRadius": 0,
      "structureDps": 0,
      "structureReach": 0,
      "enrageBelowHpFraction": 0,
      "enrageSpeedFactor": 1
    },
    {
      "id": "skiff",
      "hp": 26,
      "speedMetersPerSec": 3,
      "bounty": 10,
      "leakDamage": 1,
      "layer": "Air",
      "contactDamage": 0,
      "scatterWidth": 1.5,
      "blocksSight": false,
      "frontArmorArcDegrees": 0,
      "frontArmorFactor": 1,
      "rearWeakFactor": 1,
      "shield": 0,
      "flatArmor": 0,
      "mass": 1,
      "burrower": false,
      "splitCount": 0,
      "scrapYield": {
        "Flux": 2
      },
      "stealth": false,
      "stealthSpeedBonus": 0,
      "healPerSecond": 0,
      "healRadius": 0,
      "structureDps": 0,
      "structureReach": 0,
      "enrageBelowHpFraction": 0,
      "enrageSpeedFactor": 1
    },
    {
      "id": "aegis",
      "hp": 55,
      "speedMetersPerSec": 1.6,
      "bounty": 18,
      "leakDamage": 1,
      "layer": "Ground",
      "contactDamage": 12,
      "scatterWidth": 0,
      "blocksSight": false,
      "frontArmorArcDegrees": 140,
      "frontArmorFactor": 0.25,
      "rearWeakFactor": 1.5,
      "shield": 0,
      "flatArmor": 0,
      "mass": 3,
      "burrower": false,
      "splitCount": 0,
      "scrapYield": {
        "Plating": 3
      },
      "stealth": false,
      "stealthSpeedBonus": 0,
      "healPerSecond": 0,
      "healRadius": 0,
      "structureDps": 0,
      "structureReach": 0,
      "enrageBelowHpFraction": 0,
      "enrageSpeedFactor": 1
    },
    {
      "id": "shade",
      "hp": 34,
      "speedMetersPerSec": 2.6,
      "bounty": 11,
      "leakDamage": 1,
      "layer": "Ground",
      "contactDamage": 8,
      "scatterWidth": 0,
      "blocksSight": false,
      "frontArmorArcDegrees": 0,
      "frontArmorFactor": 1,
      "rearWeakFactor": 1,
      "shield": 0,
      "flatArmor": 0,
      "mass": 1,
      "burrower": false,
      "splitCount": 0,
      "scrapYield": {
        "Flux": 2
      },
      "stealth": true,
      "stealthSpeedBonus": 1.45,
      "healPerSecond": 0,
      "healRadius": 0,
      "structureDps": 0,
      "structureReach": 0,
      "enrageBelowHpFraction": 0,
      "enrageSpeedFactor": 1
    },
    {
      "id": "mender",
      "hp": 46,
      "speedMetersPerSec": 2,
      "bounty": 14,
      "leakDamage": 1,
      "layer": "Ground",
      "contactDamage": 4,
      "scatterWidth": 0,
      "blocksSight": false,
      "frontArmorArcDegrees": 0,
      "frontArmorFactor": 1,
      "rearWeakFactor": 1,
      "shield": 0,
      "flatArmor": 0,
      "mass": 1.2,
      "burrower": false,
      "splitCount": 0,
      "scrapYield": {
        "Flux": 2,
        "Gravium": 1
      },
      "stealth": false,
      "stealthSpeedBonus": 0,
      "healPerSecond": 7,
      "healRadius": 6,
      "structureDps": 0,
      "structureReach": 0,
      "enrageBelowHpFraction": 0,
      "enrageSpeedFactor": 1
    },
    {
      "id": "ram",
      "hp": 70,
      "speedMetersPerSec": 1.7,
      "bounty": 34,
      "leakDamage": 2,
      "layer": "Ground",
      "contactDamage": 14,
      "scatterWidth": 0,
      "blocksSight": false,
      "frontArmorArcDegrees": 150,
      "frontArmorFactor": 0.35,
      "rearWeakFactor": 2.2,
      "shield": 0,
      "flatArmor": 2,
      "mass": 6,
      "burrower": false,
      "splitCount": 0,
      "scrapYield": {
        "Plating": 3,
        "Gravium": 1
      },
      "stealth": false,
      "stealthSpeedBonus": 0,
      "healPerSecond": 0,
      "healRadius": 0,
      "structureDps": 14,
      "structureReach": 6,
      "enrageBelowHpFraction": 0.35,
      "enrageSpeedFactor": 1.6
    }
  ]
}
